<?xml version="1.0" encoding="UTF-8"?>
<empresa xmlns:xsi="http://www.w3.org/2001/XMLSchema-instance" 
         xsi:noNamespaceSchemaLocation= "CodificarPunto4.xsd">
    <nombre>Mi Empresa</nombre>
    <NIF>12345678A</NIF>
    <espaniola>true</espaniola>
    <capitalSocial>100000.00</capitalSocial>
    <direccion>
        <tipoVia>Calle</tipoVia>
        <nombreVia>Gran Vía</nombreVia>
        <CP>28001</CP>
        <pais>ESPAÑA</pais>
    </direccion>
    <empleados>
        <empleado>
            <nombre>Juan</nombre>
            <apellidos>Pérez Gómez</apellidos>
            <DNI>12345678B</DNI>
            <extranjero>false</extranjero>
            <fechaNacimiento>1990-01-01</fechaNacimiento>
            <salario>50000.00</salario>
            <direccion>
                <direccion_empleado>Calle Gran Vía 67, Madrid</direccion_empleado>
                <pais>ESPAÑA</pais>
            </direccion>
            <casado>true</casado>
        </empleado>
        <empleado>
            <nombre>Maria</nombre>
            <apellidos>Ruiz López</apellidos>
            <DNI>98765432C</DNI>
            <extranjero>true</extranjero>
            <fechaNacimiento>1985-05-15</fechaNacimiento>
            <salario>60000.00</salario>
            <direccion>
                <pais>ESPAÑA</pais>
                <direccion_empleado>Av. Diagonal 123, Barcelona</direccion_empleado>
            </direccion>
            <casado>false</casado>
        </empleado>
    </empleados>
</empresa>